{
  "$schema": "https://overkill-factory.dev/schemas/factory-method-excellence-registry.schema.json",
  "record_type": "factory_method_excellence_registry",
  "registry_id": "factory-method-excellence-registry-v1",
  "mission": "Make Overkill Factory a reference-quality product methodology layer while Hermes remains the runtime floor.",
  "runtime_boundary": {
    "hermes_owns_runtime_floor": true,
    "overkill_owns_method_contracts_and_gates": true,
    "no_mini_hermes_runtime": true,
    "use_hermes_native_kanban_typed_blocks_dependencies_dispatch_first": true
  },
  "coverage_policy": {
    "method_label_cannot_authorize_execution": true,
    "operator_does_not_choose_internal_method_by_taste": true,
    "all_method_families_require_artifacts_gates_workers_proof_and_forbidden_shortcuts": true,
    "anti_mediocrity_quality_floor_required": true,
    "learnback_required_for_method_failures": true
  },
  "public_private_boundary": {
    "public_safe_refs_only": true,
    "raw_private_evidence_embedded": false,
    "private_context_retained_outside_public_repo": true
  },
  "method_families": [
    {
      "family_id": "product_strategy_direction",
      "display_name": "Product Strategy and Direction",
      "reference_methods": ["Working Backwards / PRFAQ", "Jobs To Be Done", "Product Vision", "North Star Metric", "OKRs", "Wardley Mapping", "Opportunity Solution Tree", "product thesis"],
      "route_triggers": ["product_creation", "research_validation", "feature_delivery", "marketplace_or_platform_strategy"],
      "surface_triggers": ["new_product", "platform", "marketplace", "business_model", "operator_strategy"],
      "required_artifacts": ["product_thesis", "customer_or_operator_job", "success_metric_packet", "strategic_bet_record"],
      "required_gates": ["Strategy Gate", "Outcome Gate", "Product SOT Gate"],
      "required_workers": ["product-sot-planner", "source-ledger-worker", "factory-orchestrator"],
      "proof_requirements": ["target job/problem stated", "success metric or learning metric defined", "strategic bet and non-goals recorded", "operator-visible decision packet exists"],
      "forbidden_shortcuts": ["implementation begins without product thesis", "North Star metric invented after execution", "operator goal merged with user goal silently"],
      "legacy_method_engine_ids": ["discovery_research"],
      "learnback_hooks": ["strategy failure updates product thesis template", "wrong success metric becomes eval case"]
    },
    {
      "family_id": "discovery_research",
      "display_name": "Discovery and Research",
      "reference_methods": ["Continuous Discovery", "Customer Development", "Design Thinking", "Double Diamond", "Lean Startup", "assumption mapping", "experiment design", "research synthesis"],
      "route_triggers": ["product_creation", "research_validation", "brownfield_discovery", "problem_uncertainty"],
      "surface_triggers": ["unknown_user", "unknown_problem", "raw_paper", "competitive_research", "ambiguous_scope"],
      "required_artifacts": ["source_resolution_packet", "product_source_ledger", "assumption_ledger", "riskiest_assumption_map", "operator_understanding_confirmation"],
      "required_gates": ["Source Gate", "Research Gate", "Understanding Gate", "Product SOT Gate"],
      "required_workers": ["source-ledger-worker", "product-sot-planner", "factory-orchestrator"],
      "proof_requirements": ["source claims classified", "assumptions separated from facts", "conflicts resolved or blocked", "operator understanding confirmed before SOT promotion"],
      "forbidden_shortcuts": ["raw source becomes Product SOT", "repo supplied but not studied", "assumption becomes scope silently"],
      "legacy_method_engine_ids": ["discovery_research"],
      "learnback_hooks": ["source miss becomes source-ledger regression", "bad assumption becomes discovery checklist item"]
    },
    {
      "family_id": "product_definition_requirements",
      "display_name": "Product Definition and Requirements",
      "reference_methods": ["PRD discipline", "Spec-first / SDD", "Shape Up", "user story mapping", "Specification by Example", "BDD", "Kano", "RICE", "WSJF"],
      "route_triggers": ["product_creation", "feature_delivery", "critical_integration", "migration_execution"],
      "surface_triggers": ["scope_freeze", "acceptance_criteria", "multi_worker_execution", "release_scope"],
      "required_artifacts": ["product_sot", "full_product_sot_scope_coverage", "method_contract", "spec_graph", "acceptance_examples", "work_unit_contracts"],
      "required_gates": ["Product SOT Gate", "Scope Coverage Gate", "Method Contract Gate", "Ready Gate"],
      "required_workers": ["product-sot-planner", "decomposition-planner", "qa-verification-worker"],
      "proof_requirements": ["requirements map to source and Product SOT", "acceptance examples exist before build", "all work units trace to Product SOT", "first slice does not replace complete scope"],
      "forbidden_shortcuts": ["method label without spec artifact", "implementation before Product Creation Plan", "acceptance examples invented after execution"],
      "legacy_method_engine_ids": ["spec_first_sdd", "behavior_first_bdd"],
      "learnback_hooks": ["missed requirement becomes Product SOT coverage test", "bad work-unit decomposition updates decomposition checklist"]
    },
    {
      "family_id": "ux_product_experience_design_systems",
      "display_name": "UX, Product Experience and Design Systems",
      "reference_methods": ["human-centered design", "service blueprint", "journey mapping", "Nielsen heuristics", "WCAG", "design systems", "information architecture", "content design", "visual QA"],
      "route_triggers": ["ux_product_experience", "product_creation", "feature_delivery", "onboarding_or_docs_product"],
      "surface_triggers": ["web", "mobile", "desktop", "cli_tui", "agentic_interface", "docs", "onboarding", "visual_product"],
      "required_artifacts": ["product_experience_plan", "product_face_packet", "project_design_system", "professional_design_process", "product_face_result"],
      "required_gates": ["Product Experience Gate", "Product Face Gate", "Accessibility Gate", "Review Gate"],
      "required_workers": ["product-face", "frontend-builder", "qa-verification-worker"],
      "proof_requirements": ["journeys and states enumerated", "screenshots or equivalent surface evidence attached", "accessibility notes recorded", "Product Face Result is proof and Product Face Packet is not proof"],
      "forbidden_shortcuts": ["visible product passes without screenshots", "looks fine accepted as evidence", "Product Face Packet treated as proof"],
      "legacy_method_engine_ids": ["design_first_product_experience", "behavior_first_bdd"],
      "learnback_hooks": ["UX miss becomes Product Face regression", "a11y miss updates design-system checklist"]
    },
    {
      "family_id": "architecture_systems_design",
      "display_name": "Architecture and Systems Design",
      "reference_methods": ["Domain-Driven Design", "event storming", "C4 model", "Architecture Decision Records", "evolutionary architecture", "systems thinking", "API-first design", "dependency mapping"],
      "route_triggers": ["product_creation", "critical_integration", "migration_execution", "brownfield_discovery"],
      "surface_triggers": ["distributed_system", "api", "data_model", "integration", "trust_boundary", "domain_complexity"],
      "required_artifacts": ["architecture_packet", "domain_boundary_map", "trust_boundary_map", "adr_refs", "dependency_map"],
      "required_gates": ["Architecture Gate", "Boundary Gate", "Review Gate"],
      "required_workers": ["product-architect", "security-orchestrator", "decomposition-planner"],
      "proof_requirements": ["domain boundaries named", "tradeoffs recorded", "dependencies mapped", "architecture decisions cite Product SOT"],
      "forbidden_shortcuts": ["implementation starts before required architecture", "ADR replaced by chat summary", "trust boundary hidden inside code"],
      "legacy_method_engine_ids": ["spec_first_sdd", "legacy_diagnosis"],
      "learnback_hooks": ["architecture failure becomes ADR checklist item", "integration miss updates dependency-map template"]
    },
    {
      "family_id": "engineering_execution_quality",
      "display_name": "Engineering Execution Quality",
      "reference_methods": ["TDD", "BDD", "Specification by Example", "CI/CD", "trunk-based development", "code review", "contract testing", "property-based testing", "static analysis"],
      "route_triggers": ["feature_delivery", "bug_repair", "critical_integration", "migration_execution"],
      "surface_triggers": ["code", "tests", "api", "frontend", "backend", "infra", "agent_runtime"],
      "required_artifacts": ["test_plan", "regression_tests", "verification_commands", "implementation_result", "review_result"],
      "required_gates": ["Ready Gate", "Review Gate", "Done Gate", "Verification Gate"],
      "required_workers": ["implementation-worker", "qa-verification-worker", "test-automation-builder", "independent-reviewer"],
      "proof_requirements": ["target or failing test exists before material code when feasible", "verification commands pass", "independent review recorded for risk surfaces", "Receipt Five cites evidence"],
      "forbidden_shortcuts": ["manual check as only proof", "artifact existence treated as PASS", "worker self-approves high-risk work"],
      "legacy_method_engine_ids": ["test_first_tdd", "behavior_first_bdd", "spec_first_sdd"],
      "learnback_hooks": ["escaped bug becomes regression", "review miss updates worker quality floor"]
    },
    {
      "family_id": "security_privacy_safety",
      "display_name": "Security, Privacy and Safety",
      "reference_methods": ["NIST SSDF", "OWASP SAMM", "OWASP ASVS", "OWASP MASVS", "OWASP API Security", "STRIDE", "PASTA", "SLSA", "SBOM", "privacy by design", "abuse-case analysis", "agentic threat modeling"],